{
  "schemaVersion": 4,
  "name": "Release evidence baseline",
  "expectedAnalyserVersion": "5.1.0",
  "expectedCatalogueVersion": "2.3.0",
  "expectedBcdVersion": "8.1.4",
  "attestation": {
    "required": false,
    "certificateIssuer": "https://token.actions.githubusercontent.com/",
    "certificateIdentity": "https://github.com/example/example/.github/workflows/evidence.yml@refs/heads/main"
  },
  "scopeInventory": {
    "required": true,
    "allowedKinds": ["framework_manifest", "authorised_crawl", "test_suite"],
    "requireComplete": true,
    "expectedFingerprint": "208864f36129dadbec6ca6bf956e8ff7d52fa88778545f4e39d5bd3c7ec8968c",
    "maxAgeDays": 7,
    "maxExcludedEntries": 0
  },
  "identity": {
    "applicationId": "example-app",
    "allowedEnvironments": ["staging"],
    "expectedRevision": "0123456789abcdef0123456789abcdef01234567",
    "allowedProducerKinds": ["application_ci"],
    "requireBuildId": true,
    "maxAgeDays": 7,
    "maxCaptureDurationMinutes": 30
  },
  "surfaces": [
    {
      "id": "document",
      "role": "document",
      "requiredEvidence": ["response", "html", "request", "webauthn"],
      "requiredControls": [
        "content-security-policy",
        "csp-nonces",
        "csp-base-uri",
        "csp-frame-ancestors",
        "csp-form-action",
        "subresource-integrity",
        "integrity-policy",
        "cross-origin-opener-policy",
        "cross-origin-embedder-policy",
        "strict-transport-security",
        "x-content-type-options",
        "referrer-policy",
        "samesite-cookies",
        "httponly-cookies",
        "secure-cookie-prefixes",
        "fetch-metadata",
        "webauthn-platform-authenticator",
        "webauthn-prf",
        "webauthn-conditional-mediation"
      ],
      "requiredComposites": [
        "strict-csp-candidate",
        "cross-origin-isolation-candidate",
        "cookie-attribute-coverage"
      ]
    }
  ],
  "rules": {
    "missing": "fail",
    "reportOnly": "fail",
    "inconclusive": "review",
    "notEvaluated": "fail",
    "compositeReview": "review"
  },
  "exceptions": []
}
